[
  {
    "id": "stone_age",
    "name": "Stone Age",
    "index": 0,
    "advance_cost": {},
    "advance_prerequisites": [],
    "research_time": 0,
    "research_multiplier": 1.0,
    "flavor_text": "Survival basics. No Knowledge generation."
  },
  {
    "id": "bronze_age",
    "name": "Bronze Age",
    "index": 1,
    "advance_cost": { "food": 200, "wood": 200, "stone": 200 },
    "advance_prerequisites": "all_previous_age",
    "research_time": 40,
    "research_multiplier": 1.0,
    "flavor_text": "First civilizations. Writing enables Knowledge generation."
  },
  {
    "id": "iron_age",
    "name": "Iron Age",
    "index": 2,
    "advance_cost": { "food": 400, "wood": 400, "stone": 200, "gold": 200 },
    "advance_prerequisites": "all_previous_age",
    "research_time": 60,
    "research_multiplier": 1.1,
    "flavor_text": "Classical civilizations. Philosophy, mathematics, law."
  },
  {
    "id": "medieval_age",
    "name": "Medieval Age",
    "index": 3,
    "advance_cost": { "food": 600, "wood": 600, "stone": 400, "gold": 400 },
    "advance_prerequisites": "all_previous_age",
    "research_time": 90,
    "research_multiplier": 1.2,
    "flavor_text": "Feudalism, castles, gunpowder, ocean exploration."
  },
  {
    "id": "industrial_age",
    "name": "Industrial Age",
    "index": 4,
    "advance_cost": { "food": 800, "wood": 800, "gold": 600, "knowledge": 400 },
    "advance_prerequisites": "all_previous_age",
    "research_time": 120,
    "research_multiplier": 1.5,
    "flavor_text": "Major acceleration begins. War bonus becomes significant."
  },
  {
    "id": "information_age",
    "name": "Information Age",
    "index": 5,
    "advance_cost": { "food": 1000, "gold": 1000, "knowledge": 800 },
    "advance_prerequisites": "all_previous_age",
    "research_time": 150,
    "research_multiplier": 2.5,
    "flavor_text": "Research acceleration is dramatic. The AGI precursor chain begins."
  },
  {
    "id": "singularity_age",
    "name": "Singularity Age",
    "index": 6,
    "advance_cost": { "gold": 1500, "knowledge": 1500 },
    "advance_prerequisites": "all_previous_age",
    "research_time": 200,
    "research_multiplier": 5.0,
    "flavor_text": "Exponential research. The AGI race. Every tech choice is critical."
  }
]
